
<!ELEMENT CATALOGO (CD*)>
<!ELEMENT CD (TITULO,ARTISTA*,PAIS,DISCOGRAFICA?,PRECIO*,AÑO,CODIGO?)>
<!ELEMENT TITULO (#PCDATA)>
<!ELEMENT ARTISTA (#PCDATA)  >
<!ELEMENT PAIS (#PCDATA)>
<!ELEMENT DISCOGRAFICA (#PCDATA)>
<!ELEMENT PRECIO (#PCDATA)>
<!ELEMENT AÑO (#PCDATA)>
<!ELEMENT CODIGO (#PCDATA)>
<!ATTLIST PRECIO MONEDA (DOLAR|LIBRA|EURO) #IMPLIED>
